tag,utterance
SENTENCE:STATEMENT,I want you to buy bitcoin
SENTENCE:STATEMENT,In my opinion, this restaurant has the best pizza in town
SENTENCE:STATEMENT,Jimmy loves his dog
SENTENCE:STATEMENT,Laughter is the best medicine
SENTENCE:STATEMENT,Money cannot buy happiness
SENTENCE:STATEMENT,Music has a profound impact on human emotions
SENTENCE:STATEMENT,People should be treated equally regardless of their race gender or sexuality
SENTENCE:STATEMENT,Playing sports is good for your health
SENTENCE:STATEMENT,Reading books before bed helps me fall asleep
SENTENCE:STATEMENT,Reading books is a great way to expand your knowledge
SENTENCE:STATEMENT,Reading can improve your vocabulary and critical thinking skills
SENTENCE:STATEMENT,Reading is an important part of learning
SENTENCE:STATEMENT,Reading is my favorite hobby
SENTENCE:STATEMENT,She is an excellent cook
SENTENCE:STATEMENT,She reads two newspapers every day
SENTENCE:STATEMENT,The Amazon Rainforest is the largest rainforest in the world
SENTENCE:STATEMENT,The Declaration of Independence was signed on July 4, 1776
SENTENCE:STATEMENT,The Earth is round
SENTENCE:STATEMENT,The Earth revolves around the sun
SENTENCE:STATEMENT,The Great Barrier Reef is the largest coral reef system in the world
SENTENCE:STATEMENT,The Great Barrier Reef is the world's largest coral reef system
SENTENCE:STATEMENT,The Mona Lisa is a famous painting by Leonardo da Vinci
SENTENCE:STATEMENT,The Mona Lisa is a painting by Leonardo da Vinci
SENTENCE:STATEMENT,The Mona Lisa was painted by Leonardo da Vinci
SENTENCE:STATEMENT,The Statue of Liberty was a gift from France to the United States
SENTENCE:STATEMENT,The Titanic was a British passenger ship that famously sank in 1912
SENTENCE:STATEMENT,The United States is the third-largest country in the world by area
SENTENCE:STATEMENT,The arts are an important aspect of human culture
SENTENCE:STATEMENT,The beach is my happy place
SENTENCE:STATEMENT,The company's profits have been steadily increasing
SENTENCE:STATEMENT,The early bird catches the worm
SENTENCE:STATEMENT,The earth is round
SENTENCE:STATEMENT,The economy is improving
SENTENCE:STATEMENT,The environment is suffering from pollution and climate change
SENTENCE:STATEMENT,The first iPhone was released in 2007
SENTENCE:STATEMENT,The government will make an announcement at noon
SENTENCE:STATEMENT,The human body is made up of approximately 60% water
SENTENCE:STATEMENT,The human brain weighs approximately three pounds
SENTENCE:STATEMENT,The internet has changed the way we communicate
SENTENCE:STATEMENT,The internet has revolutionized the way we communicate
SENTENCE:STATEMENT,The movie was very suspenseful
SENTENCE:STATEMENT,The sky is so blue today
SENTENCE:STATEMENT,The sun is a star that is located at the center of our solar system
SENTENCE:STATEMENT,The sun rises in the east and sets in the west
SENTENCE:STATEMENT,The world is facing a climate crisis
SENTENCE:STATEMENT,Travel broadens the mind
SENTENCE:STATEMENT,Traveling alone can be a great experience
SENTENCE:STATEMENT,Watching movies is my favorite pastime
SENTENCE:STATEMENT,Water boils at 100 degrees Celsius
SENTENCE:STATEMENT,We should all strive to be more environmentally conscious in our daily lives
SENTENCE:STATEMENT,not a question